{
  "gates": [],
  "go_criteria": [
    {
      "actual": "0",
      "criterion": "CRITICAL findings",
      "passed": true,
      "threshold": "0"
    },
    {
      "actual": "26%",
      "criterion": "A+B rate",
      "passed": false,
      "threshold": ">= 50%"
    },
    {
      "actual": "0%",
      "criterion": "D+F rate",
      "passed": true,
      "threshold": "<= 30%"
    }
  ],
  "pages": [
    {
      "check_results": {
        "completeness": false,
        "content_density": true,
        "heading_quality": true,
        "opening_sentence_quality": true
      },
      "content_path": "products.aspose.org/slides/_index",
      "findings": [
        {
          "check": "completeness",
          "location": "entire document",
          "message": "The page omits coverage of several required claims (e.g., slide cloning, speaker notes, header/footer manipulation, image embedding, PDF conversion, 3‑D effects details).",
          "section_id": null,
          "severity": "high"
        },
        {
          "check": "heading_quality",
          "location": "H2 headings",
          "message": "Headings are generic; replace with specific titles such as \"Library Overview\", \"Core Feature Set\", \"Getting Started with a New Presentation\", \"Additional Resources\".",
          "section_id": null,
          "severity": "medium"
        },
        {
          "check": "content_density",
          "location": "Quick Start section",
          "message": "\"Quick Start\" provides only one sentence of explanation before the code block; add at least one more paragraph describing what the code does and any important considerations.",
          "section_id": null,
          "severity": "medium"
        },
        {
          "check": "opening_sentence_quality",
          "location": "Overview section, first sentence",
          "message": "The first sentence begins with the product name \"Aspose.Slides\", which is discouraged.",
          "section_id": null,
          "severity": "low"
        },
        {
          "check": "heading_quality",
          "location": "Key Features heading",
          "message": "The \"Key Features\" heading is vague; consider \"Key Features and Supported Slide Elements\" to convey specific content.",
          "section_id": null,
          "severity": "medium"
        }
      ],
      "grade": "C",
      "numeric_score": 0.0,
      "slug": "_index"
    },
    {
      "check_results": {
        "artifacts": false,
        "content_density": false,
        "tone_and_style": true
      },
      "content_path": "docs.aspose.org/slides/_index",
      "findings": [
        {
          "check": "artifacts",
          "location": "_index",
          "message": "[ENG] 3 link(s) have an empty or missing href (e.g. '[text]()'). Broken links are visible to readers.",
          "section_id": null,
          "severity": "high"
        },
        {
          "check": "tone_and_style",
          "location": "Page start, first paragraph",
          "message": "The opening sentence starts with the product name \"Aspose.Slides\", which violates the low‑severity opening‑sentence guideline.",
          "section_id": null,
          "severity": "low"
        },
        {
          "check": "content_density",
          "location": "See Also section",
          "message": "Three items in the \"See Also\" list have empty href attributes (`[Python slides library overview](`, etc.), resulting in broken links visible to readers.",
          "section_id": null,
          "severity": "high"
        }
      ],
      "grade": "C",
      "numeric_score": 0.0,
      "slug": "_index"
    },
    {
      "check_results": {
        "content_density": true,
        "opening_sentence_quality": true,
        "seo": true,
        "structure": true
      },
      "content_path": "docs.aspose.org/slides/python/developer-guide/installation",
      "findings": [
        {
          "check": "seo",
          "location": "installation",
          "message": "Product name not in title",
          "section_id": null,
          "severity": "low"
        },
        {
          "check": "seo",
          "location": "installation",
          "message": "No keywords found in page body (first 2000 chars)",
          "section_id": null,
          "severity": "low"
        },
        {
          "check": "structure",
          "location": "Best Practices",
          "message": "Section 'Best Practices' has 0 words (golden spec requires ≥30).",
          "section_id": "Best Practices",
          "severity": "medium"
        },
        {
          "check": "content_density",
          "location": "section 'Best Practices'",
          "message": "The **Best Practices** section contains no explanatory text (0 words); at least 30 words are required.",
          "section_id": null,
          "severity": "medium"
        },
        {
          "check": "content_density",
          "location": "section 'Key Features'",
          "message": "The **Key Features** section consists solely of a bullet list with no introductory paragraph.",
          "section_id": null,
          "severity": "low"
        },
        {
          "check": "opening_sentence_quality",
          "location": "first paragraph after H1",
          "message": "The opening sentence starts with the product name \"Aspose.Slides\", which is discouraged.",
          "section_id": null,
          "severity": "low"
        }
      ],
      "grade": "B",
      "numeric_score": 0.0,
      "slug": "installation"
    },
    {
      "check_results": {
        "artifacts": false,
        "code_correctness": false,
        "content_density": true,
        "heading_quality": true,
        "link_integrity": false,
        "opening_sentence_quality": true,
        "seo": true,
        "structure": true
      },
      "content_path": "docs.aspose.org/slides/python/developer-guide/getting-started",
      "findings": [
        {
          "check": "artifacts",
          "location": "getting-started",
          "message": "[ENG] 1 link(s) have an empty or missing href (e.g. '[text]()'). Broken links are visible to readers.",
          "section_id": null,
          "severity": "high"
        },
        {
          "check": "seo",
          "location": "getting-started",
          "message": "Product name not in title",
          "section_id": null,
          "severity": "low"
        },
        {
          "check": "seo",
          "location": "getting-started",
          "message": "No keywords found in page body (first 2000 chars)",
          "section_id": null,
          "severity": "low"
        },
        {
          "check": "structure",
          "location": "getting-started",
          "message": "Page body has 464 prose words; golden spec requires ≥994.",
          "section_id": null,
          "severity": "medium"
        },
        {
          "check": "code_correctness",
          "location": "multiple code fences throughout the page",
          "message": "Code blocks are missing the required language tag (e.g., ```python```).",
          "section_id": null,
          "severity": "high"
        },
        {
          "check": "content_density",
          "location": "entire page body",
          "message": "Total prose word count is 464, which is below the required minimum of 994 words for a developer‑guide page.",
          "section_id": null,
          "severity": "medium"
        },
        {
          "check": "link_integrity",
          "location": "Next Steps section",
          "message": "One or more markdown links have empty or missing href attributes (e.g., `[Working with Shapes]( guide.`).",
          "section_id": null,
          "severity": "high"
        },
        {
          "check": "opening_sentence_quality",
          "location": "Overview section, first sentence",
          "message": "The opening sentence starts with the product name \"Aspose.Slides for Python\", which is discouraged.",
          "section_id": null,
          "severity": "low"
        },
        {
          "check": "heading_quality",
          "location": "All H2 headings",
          "message": "Some H2 headings are overly generic (e.g., \"Overview\", \"Prerequisites\", \"Next Steps\") and do not convey specific content at a glance.",
          "section_id": null,
          "severity": "medium"
        }
      ],
      "grade": "C",
      "numeric_score": 0.0,
      "slug": "getting-started"
    },
    {
      "check_results": {
        "artifacts": false,
        "broken_links": false,
        "code_correctness": false,
        "content_density": false,
        "opening_sentence_quality": true
      },
      "content_path": "reference.aspose.org/slides/_index",
      "findings": [
        {
          "check": "artifacts",
          "location": "_index",
          "message": "[ENG] 2 link(s) have an empty or missing href (e.g. '[text]()'). Broken links are visible to readers.",
          "section_id": null,
          "severity": "high"
        },
        {
          "check": "code_correctness",
          "location": "Quick Install, code block 1",
          "message": "The `pip install` command is placed in a Python‑tagged code block, which is syntactically invalid Python.",
          "section_id": null,
          "severity": "high"
        },
        {
          "check": "content_density",
          "location": "Getting Started",
          "message": "\"Getting Started\" section provides only one paragraph of explanatory text before the code example, insufficient for developers to act without external references.",
          "section_id": null,
          "severity": "high"
        },
        {
          "check": "opening_sentence_quality",
          "location": "Capabilities (first paragraph)",
          "message": "The opening sentence starts with the product name \"Aspose.Slides\", which violates the low‑severity opening‑sentence rule.",
          "section_id": null,